{
  "schema_version": "0.1.0",
  "message_type": "pose_frame",
  "session_id": "synthetic-session-001",
  "stream_id": "synthetic-camera-p1",
  "player_id": "p1",
  "sequence": 0,
  "captured_at_ns": "1000000000",
  "clock_domain": "synthetic-clock",
  "calibration_id": "synthetic-calibration-001",
  "coordinate_frame": "camera_optical_rh",
  "skeleton_id": "canonical19",
  "joints": {
    "pelvis": {"position_m": [0, 0, 2], "confidence": 1, "tracking_state": "inferred"},
    "spine": {"position_m": [0, -0.2, 2], "confidence": 1, "tracking_state": "inferred"},
    "chest": {"position_m": [0, -0.4, 2], "confidence": 1, "tracking_state": "inferred"},
    "neck": {"position_m": [0, -0.52, 2], "confidence": 1, "tracking_state": "inferred"},
    "head": {"position_m": [0, -0.7, 2], "confidence": 1, "tracking_state": "inferred"},
    "left_shoulder": {"position_m": [0.2, -0.4, 2], "confidence": 1, "tracking_state": "observed"},
    "left_elbow": {"position_m": [0.5, -0.4, 2], "confidence": 1, "tracking_state": "observed"},
    "left_wrist": {"position_m": [0.75, -0.4, 2], "confidence": 1, "tracking_state": "observed"},
    "right_shoulder": {"position_m": [-0.2, -0.4, 2], "confidence": 1, "tracking_state": "observed"},
    "right_elbow": {"position_m": [-0.5, -0.4, 2], "confidence": 1, "tracking_state": "observed"},
    "right_wrist": {"position_m": [-0.75, -0.4, 2], "confidence": 1, "tracking_state": "observed"},
    "left_hip": {"position_m": [0.12, 0, 2], "confidence": 1, "tracking_state": "observed"},
    "left_knee": {"position_m": [0.12, 0.45, 2], "confidence": 1, "tracking_state": "observed"},
    "left_ankle": {"position_m": [0.12, 0.85, 2], "confidence": 1, "tracking_state": "observed"},
    "left_toe": {"position_m": [0.12, 0.9, 1.85], "confidence": 1, "tracking_state": "observed"},
    "right_hip": {"position_m": [-0.12, 0, 2], "confidence": 1, "tracking_state": "observed"},
    "right_knee": {"position_m": [-0.12, 0.45, 2], "confidence": 1, "tracking_state": "observed"},
    "right_ankle": {"position_m": [-0.12, 0.85, 2], "confidence": 1, "tracking_state": "observed"},
    "right_toe": {"position_m": null, "confidence": 0, "tracking_state": "missing"}
  }
}
